{
  "report": "wakaba-map-report/1",
  "map": "haison",
  "seed": "haison-001",
  "builtAt": "2026-10-17T07:17:53.799Z",
  "builder": "claude-code",
  "auto": {
    "deterministic": {"pass": true, "hash": "fp:1f763c2eed098e", "terrain": "950cb13f"},
    "keepOut": {"pass": true, "violations": [], "checked": {"objects": 958, "small": 18073, "buildings": 5, "shapes": 225}},
    "float": {"pass": true, "items": [], "counts": {"float": 0, "penetrate": 0}},
    "overlap": {"pass": true, "items": [], "count": 0},
    "reach": {
      "pass": true,
      "goals": {"h1.door": 135.62, "h2.door": 148.74, "h4.door": 136.29, "h1.center": 142.24, "shrine.front": 205.88},
      "unreachable": [],
      "ratio": {"h1.door": 1.03, "h2.door": 1.05, "h4.door": 1.05, "h1.center": 1.11, "shrine.front": 1.03},
      "grid": {"cell": 0.5, "maxSlope": 35, "step": 0.4, "walkable": 145175, "reached": 104544}
    },
    "interiors": {
      "pass": true,
      "rooms": [
        {"id": "h1.doma", "reach": 140.33, "ceiling": 2.52, "pass": true},
        {"id": "h1.washitsu_6", "reach": 142.24, "ceiling": 2.17, "pass": true},
        {"id": "h1.daidokoro", "reach": 146.16, "ceiling": 2.17, "pass": true},
        {"id": "h2.doma", "reach": 152.66, "ceiling": 2.52, "pass": true},
        {"id": "h2.washitsu_6", "reach": 154.66, "ceiling": 2.17, "pass": true},
        {"id": "h4.doma", "reach": 140, "ceiling": 2.52, "pass": true},
        {"id": "h4.washitsu_6", "reach": 141.42, "ceiling": 2.17, "pass": true}
      ]
    },
    "license": {
      "pass": true,
      "blocked": [],
      "note": "物の種類 23 のうち 23 が目録の素材（web の門 pass・自作＝license own・verifiedBy は人の確認待ち）・仮の形 0。材質と建物の部品も目録（node tools/mapkit/catalog.mjs）"
    },
    "budget": {
      "pass": true,
      "preset": "low",
      "drawCalls": 90,
      "tris": 48034,
      "texMB": 30.9,
      "source": "measured（play_map.mjs・スマホ 844×390・テクスチャは辺×4B×4/3 の見積もり）"
    },
    "perf": {
      "device": "swiftshader",
      "fps": null,
      "note": "fps は実機で測る（mapkit.html?perf=1）。起動（操作できるまで）PC high 4879ms・スマホ low 3420ms（ソフト描画）。PC high：描画 216・三角形 490930。段ごと（村の視点）：ultra 描画 201・三角形 693k・テクスチャ 196.9MB／high 描画 182・三角形 423k・テクスチャ 196.9MB／mid 描画 99・三角形 146k・テクスチャ 108.9MB／low 描画 72・三角形 95k・テクスチャ 30.9MB"
    },
    "entrances": {"pass": true, "violations": []},
    "slope": {
      "pass": true,
      "items": [],
      "buildings": [
        {"id": "h1", "slope": 0.25},
        {"id": "h2", "slope": 0.08},
        {"id": "h3", "slope": 0.02},
        {"id": "h4", "slope": 0.02},
        {"id": "shrine", "slope": 0.71}
      ]
    },
    "fall": {
      "pass": true,
      "edgeCells": 10,
      "guard": "坂 40° を超える所・段差 0.4m を超える所は操作（mapkit/runtime/controller.js）が壁として止める＝落ちない（boundary: invisible_wall_on_cliff）"
    }
  },
  "conditions": [
    {"text": "霧がある", "check": "auto", "pass": true, "evidence": "atmosphere.fog.density=0.035"},
    {"text": "夕暮れ（仕様の値）", "check": "auto", "pass": true, "evidence": "atmosphere.time=dusk・sunElevDeg=4"},
    {"text": "入れる家が 2 軒以上（中の全部屋に届く）", "check": "auto", "pass": true, "evidence": "h1,h2,h4・部屋 7"},
    {
      "text": "家の入口 3 つ以上へ歩いて届く（坂 35° 以下・段差 0.4m 以下）",
      "check": "auto",
      "pass": true,
      "evidence": "h1.door 135.62m・h2.door 148.74m・h4.door 136.29m"
    },
    {"text": "祠へ歩いて届く", "check": "auto", "pass": true, "evidence": "shrine.front 205.88m（石段 5 段）"},
    {"text": "崖がある（傾き 45° 超の升目）", "check": "auto", "pass": true, "evidence": "17813 升目"},
    {"text": "森（木 300 本以上）", "check": "auto", "pass": true, "evidence": "木 865・岩 39・下草 18073"},
    {"text": "入口の前・道・目的地に物が 0 個", "check": "auto", "pass": true, "evidence": "違反 0＋0"},
    {"text": "浮き・めり込み・重なりが 0 件", "check": "auto", "pass": true, "evidence": "浮き 0・めり込み 0・重なり 0"},
    {"text": "同じ種で同じ配置", "check": "auto", "pass": true, "evidence": "fp:1f763c2eed098e"},
    {"text": "夕暮れと霧の雰囲気が出ている", "check": "human", "pass": null, "evidence": "play_map の画面撮影（village・shrine）"},
    {
      "text": "山の廃村に見える（フェーズ 3：写実寄りの材質・部品・光）",
      "check": "human",
      "pass": null,
      "evidence": "play_map の撮影（village・house・interior・forest）と before_after.png"
    },
    {
      "text": "自作の素材（目録の license own）の中身を人が確かめた（meta.json の verifiedBy を書く）",
      "check": "human",
      "pass": null,
      "evidence": "wakaba-assets/entries/*/*/meta.json・docs/wakaba-mapkit/11"
    },
    {"text": "森の密度・木の並びが自然", "check": "human", "pass": null, "evidence": "forest の撮影・report/map.svg"},
    {"text": "歩いて探索できる（迷わない・引っかからない）", "check": "human", "pass": null, "evidence": "利用者が mapkit.html?map=haison を歩く"},
    {"text": "Playwright で実際に歩いて全ての目的地に着く（PC・スマホ）", "check": "auto", "pass": true, "evidence": "report/play.json：27/27"}
  ],
  "gaps": [
    {"need": "prop.barrel", "plan": "目録の素材 prop.barrel（樽）で描く（ブラウザ版）。当たり・置き場所は仮の形（樽）の大きさのまま", "status": "done"},
    {"need": "prop.beam", "plan": "目録の素材 prop.beam（落ちた梁）で描く（ブラウザ版）。当たり・置き場所は仮の形（落ちた梁）の大きさのまま", "status": "done"},
    {
      "need": "prop.bicycle",
      "plan": "目録の素材 prop.bicycle（錆びた自転車（横倒し））で描く（ブラウザ版）。当たり・置き場所は仮の形（錆びた自転車（横倒し））の大きさのまま",
      "status": "done"
    },
    {"need": "prop.crate", "plan": "目録の素材 prop.crate（木箱）で描く（ブラウザ版）。当たり・置き場所は仮の形（木箱）の大きさのまま", "status": "done"},
    {"need": "prop.debris", "plan": "目録の素材 prop.debris（瓦礫（土壁・瓦・小舞））で描く（ブラウザ版）。当たり・置き場所は仮の形（瓦礫）の大きさのまま", "status": "done"},
    {
      "need": "prop.door_fallen",
      "plan": "目録の素材 prop.door_fallen（倒れた障子）で描く（ブラウザ版）。当たり・置き場所は仮の形（倒れた障子）の大きさのまま",
      "status": "done"
    },
    {
      "need": "prop.fence",
      "plan": "目録の素材 prop.fence（壊れかけの木の柵（2m））で描く（ブラウザ版）。当たり・置き場所は仮の形（壊れかけの木の柵）の大きさのまま",
      "status": "done"
    },
    {"need": "prop.futon", "plan": "目録の素材 prop.futon（朽ちた布団）で描く（ブラウザ版）。当たり・置き場所は仮の形（朽ちた布団）の大きさのまま", "status": "done"},
    {"need": "prop.irori", "plan": "目録の素材 prop.irori（囲炉裏（鉄瓶と五徳））で描く（ブラウザ版）。当たり・置き場所は仮の形（囲炉裏）の大きさのまま", "status": "done"},
    {"need": "prop.ishigaki", "plan": "目録の素材 prop.ishigaki（石垣（2m））で描く（ブラウザ版）。当たり・置き場所は仮の形（石垣（2m））の大きさのまま", "status": "done"},
    {"need": "prop.kamado", "plan": "目録の素材 prop.kamado（かまど）で描く（ブラウザ版）。当たり・置き場所は仮の形（かまど）の大きさのまま", "status": "done"},
    {
      "need": "prop.komainu",
      "plan": "目録の素材 prop.komainu（狛犬（オリジナルの簡単な石像））で描く（ブラウザ版）。当たり・置き場所は仮の形（狛犬）の大きさのまま",
      "status": "done"
    },
    {"need": "prop.planks", "plan": "目録の素材 prop.planks（板の山）で描く（ブラウザ版）。当たり・置き場所は仮の形（板の山）の大きさのまま", "status": "done"},
    {
      "need": "prop.shelf_fallen",
      "plan": "目録の素材 prop.shelf_fallen（倒れた棚）で描く（ブラウザ版）。当たり・置き場所は仮の形（倒れた棚）の大きさのまま",
      "status": "done"
    },
    {"need": "prop.sign", "plan": "目録の素材 prop.sign（色あせた立て札）で描く（ブラウザ版）。当たり・置き場所は仮の形（色あせた立て札）の大きさのまま", "status": "done"},
    {
      "need": "prop.stone_lantern",
      "plan": "目録の素材 prop.stone_lantern（石灯籠（春日型））で描く（ブラウザ版）。当たり・置き場所は仮の形（石灯籠）の大きさのまま",
      "status": "done"
    },
    {"need": "prop.tansu", "plan": "目録の素材 prop.tansu（箪笥（引き出しが出ている））で描く（ブラウザ版）。当たり・置き場所は仮の形（箪笥）の大きさのまま", "status": "done"},
    {
      "need": "prop.utility_pole",
      "plan": "目録の素材 prop.utility_pole（古い木の電柱）で描く（ブラウザ版）。当たり・置き場所は仮の形（古い木の電柱）の大きさのまま",
      "status": "done"
    },
    {"need": "prop.well", "plan": "目録の素材 prop.well（井戸）で描く（ブラウザ版）。当たり・置き場所は仮の形（井戸）の大きさのまま", "status": "done"},
    {
      "need": "rock.boulder",
      "plan": "目録の素材 rock.boulder（岩（安山岩・3 種））で描く（ブラウザ版）。当たり・置き場所は仮の形（岩（仮の形））の大きさのまま",
      "status": "done"
    },
    {"need": "veg.grass", "plan": "目録の素材 veg.grass（草の株（3 枚のカード））で描く（ブラウザ版）。当たり・置き場所は仮の形（下草（仮の形））の大きさのまま", "status": "done"},
    {
      "need": "veg.tree.broadleaf",
      "plan": "目録の素材 veg.tree.broadleaf（広葉樹（カードの葉・LOD・遠景の板））で描く（ブラウザ版）。当たり・置き場所は仮の形（広葉樹（仮の形））の大きさのまま",
      "status": "done"
    },
    {
      "need": "veg.tree.sugi",
      "plan": "目録の素材 veg.tree.sugi（杉（カードの葉・LOD・遠景の板））で描く（ブラウザ版）。当たり・置き場所は仮の形（杉（仮の形））の大きさのまま",
      "status": "done"
    },
    {
      "need": "bld.jp_house_abandoned",
      "plan": "建物「h1」は部品の箱（当たり・床）のまま、見た目を目録の部品（bld.jp_house.wall_panel・bld.jp_house.post・bld.jp_house.roof_ridge）と材質で組む（mapkit/render/buildings.js）。UE5 版で 1 つの網にまとめるのは未着手",
      "status": "done"
    },
    {
      "need": "bld.jp_house_abandoned",
      "plan": "建物「h2」は部品の箱（当たり・床）のまま、見た目を目録の部品（bld.jp_house.wall_panel・bld.jp_house.post・bld.jp_house.roof_ridge）と材質で組む（mapkit/render/buildings.js）。UE5 版で 1 つの網にまとめるのは未着手",
      "status": "done"
    },
    {
      "need": "bld.jp_house_collapsed",
      "plan": "建物「h3」は部品の箱（当たり・床）のまま、見た目を目録の部品（bld.jp_house.wall_panel・bld.jp_house.post・bld.jp_house.roof_ridge）と材質で組む（mapkit/render/buildings.js）。UE5 版で 1 つの網にまとめるのは未着手",
      "status": "done"
    },
    {
      "need": "bld.jp_house_abandoned",
      "plan": "建物「h4」は部品の箱（当たり・床）のまま、見た目を目録の部品（bld.jp_house.wall_panel・bld.jp_house.post・bld.jp_house.roof_ridge）と材質で組む（mapkit/render/buildings.js）。UE5 版で 1 つの網にまとめるのは未着手",
      "status": "done"
    },
    {
      "need": "bld.hokora_small",
      "plan": "建物「shrine」は部品の箱（当たり・床）のまま、見た目を目録の部品（bld.shrine.honden・bld.shrine.torii）と材質で組む（mapkit/render/buildings.js）。UE5 版で 1 つの網にまとめるのは未着手",
      "status": "done"
    },
    {
      "need": "web.compression",
      "plan": "テクスチャは WebP・glb は圧縮なし（KTX2・Meshopt の符号器がクラウドで使えないため）。利用者の PC か CI で KTX2（toktx/basisu）・gltfpack（Meshopt）にすると、読み込み ≈40% 減の見込み（docs/wakaba-mapkit/11 §6）",
      "status": "proposed"
    },
    {
      "need": "license.verifiedBy",
      "plan": "自作の素材（tools/mapkit/matgen・tools/blender/kit で生成）は門で注意（UNVERIFIED_GENERATED）。人が中身を見て meta.json の verifiedBy を書く（AI は書かない）",
      "status": "proposed"
    },
    {
      "need": "ue5.kit",
      "plan": "同じ部品の FBX（source/・Git の外）と ue5/import.json の雛形は作った。UE5 の画面での取り込み・Nanite・材質の組み直しは未検証（利用者の PC）",
      "status": "proposed"
    }
  ],
  "fixes": [],
  "specHash": "sha256:fe5f74925c5923fac3f7d99b6b57416a846c6b44d7fd95d74ac2f25032570ba5"
}
